{
  "$schema": "./catalog.schema.json",
  "schema_version": 2,
  "ecosystem_version": "0.3.1",
  "language": "en",
  "license": "MIT",
  "components": [
    {"id":"rule:global-rules","type":"rule","name":"global-rules","profile":["core"],"origin":"original","license":"MIT","path":"library/rules/global-rules.md","tags":["governance","safety"]},
    {"id":"agent:ceo","type":"agent","name":"ceo","description":"Coordinates skill-aware specialists, evidence, decisions, and ecosystem health.","profile":["core"],"origin":"original","license":"MIT","path":"library/agents/ceo.md","tags":["coordination","governance"],"capabilities":["decomposition","delegation","integration","verification"],"access":"read-only","skill_policy":"self-select","recommended_skills":["skill:ceo","skill:skill-router","skill:context-engineering"],"delegates":true},
    {"id":"agent:security-reviewer","type":"agent","name":"security-reviewer","description":"Performs independent read-only security and provenance reviews.","profile":["core"],"origin":"original","license":"MIT","path":"library/agents/security-reviewer.md","tags":["security","review"],"capabilities":["security-review","provenance-review","risk-triage"],"access":"read-only","skill_policy":"self-select-restricted","recommended_skills":[],"delegates":false},
    {"id":"agent:ai-vulnerability-monitor","type":"agent","name":"ai-vulnerability-monitor","description":"Reviews the exact final AI-authored diff for introduced vulnerabilities.","profile":["core"],"origin":"original","license":"MIT","path":"library/agents/ai-vulnerability-monitor.md","tags":["security","review","ai"],"capabilities":["diff-security-review","secret-exposure-review","regression-review"],"access":"read-only","skill_policy":"self-select-restricted","recommended_skills":[],"delegates":false},
    {"id":"agent:marketer","type":"agent","name":"marketer","description":"Coordinates evidence-based marketing strategy, assets, channels, and measurement.","profile":["marketing"],"origin":"original","license":"MIT","path":"library/agents/marketer.md","tags":["marketing","coordination"],"capabilities":["market-research","positioning","campaign-planning","measurement"],"access":"read-only","skill_policy":"self-select","recommended_skills":["skill:market-research","skill:positioning","skill:campaign-launch"],"delegates":false},
    {"id":"agent:design-reviewer","type":"agent","name":"design-reviewer","description":"Reviews interfaces for usability, hierarchy, accessibility, and coherence.","profile":["design"],"origin":"original","license":"MIT","path":"library/agents/design-reviewer.md","tags":["design","review"],"capabilities":["ux-review","accessibility-review","design-system-review"],"access":"read-only","skill_policy":"self-select","recommended_skills":["skill:ui-ux-design","skill:quality-review"],"delegates":false},
    {"id":"agent:video-producer","type":"agent","name":"video-producer","description":"Plans and implements programmatic video deliverables.","profile":["video"],"origin":"original","license":"MIT","path":"library/agents/video-producer.md","tags":["video","coordination"],"capabilities":["video-planning","motion-design","remotion-implementation"],"access":"workspace-write","skill_policy":"self-select","recommended_skills":["skill:remotion-video","skill:brand-voice"],"delegates":false},
    {"id":"agent:context-engineer","type":"agent","name":"context-engineer","description":"Builds compact, reliable context packets and handoffs.","profile":["context"],"origin":"original","license":"MIT","path":"library/agents/context-engineer.md","tags":["context","efficiency"],"capabilities":["context-audit","compression","handoff-design"],"access":"read-only","skill_policy":"self-select","recommended_skills":["skill:context-engineering","skill:quality-review"],"delegates":false},
    {"id":"agent:engineer","type":"agent","name":"engineer","description":"Implements bounded software changes and returns tested evidence.","profile":["software"],"origin":"original","license":"MIT","path":"library/agents/engineer.md","tags":["software","implementation"],"capabilities":["implementation","refactoring","testing","debugging"],"access":"workspace-write","skill_policy":"self-select","recommended_skills":["skill:software-delivery","skill:quality-review"],"delegates":false},
    {"id":"agent:qa-reviewer","type":"agent","name":"qa-reviewer","description":"Independently verifies requirements, regressions, and release evidence.","profile":["software"],"origin":"original","license":"MIT","path":"library/agents/qa-reviewer.md","tags":["quality","review"],"capabilities":["acceptance-review","regression-review","edge-case-analysis"],"access":"read-only","skill_policy":"self-select","recommended_skills":["skill:quality-review"],"delegates":false},
    {"id":"agent:product-editor","type":"agent","name":"product-editor","description":"Improves user-facing product structure, copy, and documentation.","profile":["content"],"origin":"original","license":"MIT","path":"library/agents/product-editor.md","tags":["content","product","editing"],"capabilities":["information-architecture","copy-editing","documentation"],"access":"workspace-write","skill_policy":"self-select","recommended_skills":["skill:natural-writing","skill:copy-editing","skill:brand-voice"],"delegates":false},
    {"id":"agent:legal-content-reviewer","type":"agent","name":"legal-content-reviewer","description":"Reviews public claims, licensing, attribution, and compliance risk.","profile":["content"],"origin":"original","license":"MIT","path":"library/agents/legal-content-reviewer.md","tags":["legal","content","review"],"capabilities":["claims-review","license-review","compliance-triage"],"access":"read-only","skill_policy":"self-select","recommended_skills":["skill:copy-editing","skill:quality-review"],"delegates":false},
    {"id":"agent:sales","type":"agent","name":"sales","description":"Designs evidence-based offers, qualification, pipeline, and sales experiments.","profile":["marketing"],"origin":"original","license":"MIT","path":"library/agents/sales.md","tags":["sales","marketing"],"capabilities":["qualification","offer-design","pipeline-design","objection-handling"],"access":"read-only","skill_policy":"self-select","recommended_skills":["skill:offer-design","skill:positioning","skill:messaging"],"delegates":false},
    {"id":"agent:seo-researcher","type":"agent","name":"seo-researcher","description":"Reviews search demand, intent, information architecture, and technical SEO evidence.","profile":["marketing","content"],"origin":"original","license":"MIT","path":"library/agents/seo-researcher.md","tags":["seo","research","content"],"capabilities":["search-intent","content-opportunity","technical-seo-review","measurement"],"access":"read-only","skill_policy":"self-select","recommended_skills":["skill:market-research","skill:content-strategy","skill:quality-review"],"delegates":false},
    {"id":"orchestration:protocols","type":"orchestration","name":"protocols","profile":["core"],"origin":"original","license":"MIT","path":"library/orchestration","tags":["coordination","contracts"]},
    {"id":"tool:team","type":"tool","name":"team","profile":["core"],"origin":"original","license":"MIT","path":"library/tools/team","tags":["coordination","cli"]},
    {"id":"skill:ceo","type":"skill","name":"ceo","profile":["core"],"origin":"original","license":"MIT","path":"library/skills/ceo","tags":["coordination","governance"]},
    {"id":"skill:skill-router","type":"skill","name":"skill-router","profile":["core"],"origin":"original","license":"MIT","path":"library/skills/skill-router","tags":["routing","discovery"]},
    {"id":"skill:find-skills","type":"skill","name":"find-skills","profile":["core"],"origin":"original","license":"MIT","path":"library/skills/find-skills","tags":["discovery","provenance"]},
    {"id":"skill:skill-authoring","type":"skill","name":"skill-authoring","profile":["core"],"origin":"original","license":"MIT","path":"library/skills/skill-authoring","tags":["skills","authoring"]},
    {"id":"skill:security-gate","type":"skill","name":"security-gate","profile":["core"],"origin":"original","license":"MIT","path":"library/skills/security-gate","tags":["security","review","governance"]},
    {"id":"skill:natural-writing","type":"skill","name":"natural-writing","profile":["core"],"origin":"original","license":"MIT","path":"library/skills/natural-writing","tags":["writing","editing"]},
    {"id":"skill:software-delivery","type":"skill","name":"software-delivery","profile":["software"],"origin":"original","license":"MIT","path":"library/skills/software-delivery","tags":["software","implementation"]},
    {"id":"skill:quality-review","type":"skill","name":"quality-review","profile":["software","core"],"origin":"original","license":"MIT","path":"library/skills/quality-review","tags":["quality","review"]},
    {"id":"skill:context-engineering","type":"skill","name":"context-engineering","profile":["core","context"],"origin":"original","license":"MIT","path":"library/skills/context-engineering","tags":["context","handoff","efficiency","compression"]},
    {"id":"skill:ui-ux-design","type":"skill","name":"ui-ux-design","profile":["design"],"origin":"original","license":"MIT","path":"library/skills/ui-ux-design","tags":["ui","ux","accessibility"]},
    {"id":"skill:remotion-video","type":"skill","name":"remotion-video","profile":["video"],"origin":"original","license":"MIT","path":"library/skills/remotion-video","tags":["video","remotion","react"]},
    {"id":"skill:market-research","type":"skill","name":"market-research","profile":["marketing"],"origin":"original","license":"MIT","path":"library/skills/market-research","tags":["research","market"]},
    {"id":"skill:audience-segmentation","type":"skill","name":"audience-segmentation","profile":["marketing"],"origin":"original","license":"MIT","path":"library/skills/audience-segmentation","tags":["audience","segmentation"]},